<!DOCTYPE bookshop
[
<!ELEMENT bookshop (title,author,ISBN,price)>
<!ELEMENT title (#PCDATA)>
<!ELEMENT author (#PCDATA)>
<!ELEMENT ISBN (#PCDATA)>
<!ELEMENT price (#PCDATA)>
]>